{
  "color": {
    "background": {
      "page": {
        "$value": "#F8FAFC",
        "$type": "color"
      },
      "surface": {
        "$value": "#FFFFFF",
        "$type": "color"
      },
      "elevated": {
        "$value": "#EEF2FF",
        "$type": "color"
      }
    },
    "text": {
      "primary": {
        "$value": "#0F172A",
        "$type": "color"
      },
      "muted": {
        "$value": "#475569",
        "$type": "color"
      },
      "inverse": {
        "$value": "#FFFFFF",
        "$type": "color"
      }
    },
    "brand": {
      "primary": {
        "$value": "#4F46E5",
        "$type": "color"
      },
      "secondary": {
        "$value": "#06B6D4",
        "$type": "color"
      },
      "accent": {
        "$value": "#7C3AED",
        "$type": "color"
      },
      "accentText": {
        "$value": "#312E81",
        "$type": "color"
      }
    },
    "state": {
      "focus": {
        "$value": "#2563EB",
        "$type": "color"
      },
      "success": {
        "$value": "#16A34A",
        "$type": "color"
      }
    }
  },
  "font": {
    "family": {
      "body": {
        "$value": "Inter, system-ui, sans-serif",
        "$type": "fontFamily"
      },
      "heading": {
        "$value": "Inter Tight, Inter, system-ui, sans-serif",
        "$type": "fontFamily"
      }
    },
    "weight": {
      "regular": {
        "$value": 400,
        "$type": "number"
      },
      "bold": {
        "$value": 700,
        "$type": "number"
      }
    }
  },
  "space": {
    "xs": {
      "$value": "0.5rem",
      "$type": "dimension"
    },
    "sm": {
      "$value": "0.75rem",
      "$type": "dimension"
    },
    "md": {
      "$value": "1rem",
      "$type": "dimension"
    },
    "lg": {
      "$value": "1.5rem",
      "$type": "dimension"
    },
    "xl": {
      "$value": "2.25rem",
      "$type": "dimension"
    },
    "2xl": {
      "$value": "4.5rem",
      "$type": "dimension"
    }
  },
  "size": {
    "container": {
      "$value": "76rem",
      "$type": "dimension"
    },
    "measure": {
      "$value": "44rem",
      "$type": "dimension"
    },
    "heroMinHeight": {
      "$value": "32rem",
      "$type": "dimension"
    }
  },
  "radius": {
    "sm": {
      "$value": "0.375rem",
      "$type": "dimension"
    },
    "md": {
      "$value": "0.875rem",
      "$type": "dimension"
    },
    "lg": {
      "$value": "1.5rem",
      "$type": "dimension"
    },
    "pill": {
      "$value": "999px",
      "$type": "dimension"
    }
  },
  "shadow": {
    "sm": {
      "$value": "0 1px 2px rgb(15 23 42 / 0.08)",
      "$type": "shadow"
    },
    "card": {
      "$value": "0 20px 50px rgb(79 70 229 / 0.16)",
      "$type": "shadow"
    }
  },
  "motion": {
    "fast": {
      "$value": "120ms",
      "$type": "duration"
    },
    "standard": {
      "$value": "220ms",
      "$type": "duration"
    }
  },
  "breakpoint": {
    "sm": {
      "$value": "640px",
      "$type": "dimension"
    },
    "md": {
      "$value": "768px",
      "$type": "dimension"
    },
    "lg": {
      "$value": "1024px",
      "$type": "dimension"
    }
  },
  "zIndex": {
    "header": {
      "$value": 10,
      "$type": "number"
    },
    "overlay": {
      "$value": 20,
      "$type": "number"
    }
  }
}
