{
  "color": {
    "background": {
      "page": {
        "$value": "#F7FBFC",
        "$type": "color"
      },
      "surface": {
        "$value": "#FFFFFF",
        "$type": "color"
      },
      "sand": {
        "$value": "#F7E8C8",
        "$type": "color"
      }
    },
    "text": {
      "primary": {
        "$value": "#102A43",
        "$type": "color"
      },
      "muted": {
        "$value": "#486581",
        "$type": "color"
      },
      "inverse": {
        "$value": "#FFFFFF",
        "$type": "color"
      }
    },
    "brand": {
      "primary": {
        "$value": "#006D77",
        "$type": "color"
      },
      "secondary": {
        "$value": "#00A6A6",
        "$type": "color"
      },
      "accent": {
        "$value": "#F97316",
        "$type": "color"
      },
      "accentText": {
        "$value": "#7C2D12",
        "$type": "color"
      }
    },
    "state": {
      "focus": {
        "$value": "#0EA5E9",
        "$type": "color"
      },
      "success": {
        "$value": "#15803D",
        "$type": "color"
      }
    }
  },
  "font": {
    "family": {
      "body": {
        "$value": "Inter, system-ui, sans-serif",
        "$type": "fontFamily"
      },
      "heading": {
        "$value": "Fraunces, Georgia, serif",
        "$type": "fontFamily"
      }
    },
    "weight": {
      "regular": {
        "$value": 400,
        "$type": "number"
      },
      "bold": {
        "$value": 700,
        "$type": "number"
      }
    }
  },
  "space": {
    "xs": {
      "$value": "0.5rem",
      "$type": "dimension"
    },
    "sm": {
      "$value": "0.75rem",
      "$type": "dimension"
    },
    "md": {
      "$value": "1rem",
      "$type": "dimension"
    },
    "lg": {
      "$value": "1.5rem",
      "$type": "dimension"
    },
    "xl": {
      "$value": "2.5rem",
      "$type": "dimension"
    },
    "2xl": {
      "$value": "4rem",
      "$type": "dimension"
    }
  },
  "size": {
    "container": {
      "$value": "72rem",
      "$type": "dimension"
    },
    "measure": {
      "$value": "42rem",
      "$type": "dimension"
    },
    "heroMinHeight": {
      "$value": "34rem",
      "$type": "dimension"
    }
  },
  "radius": {
    "sm": {
      "$value": "0.375rem",
      "$type": "dimension"
    },
    "md": {
      "$value": "0.75rem",
      "$type": "dimension"
    },
    "lg": {
      "$value": "1.25rem",
      "$type": "dimension"
    },
    "pill": {
      "$value": "999px",
      "$type": "dimension"
    }
  },
  "shadow": {
    "sm": {
      "$value": "0 1px 2px rgb(16 42 67 / 0.08)",
      "$type": "shadow"
    },
    "card": {
      "$value": "0 16px 40px rgb(16 42 67 / 0.14)",
      "$type": "shadow"
    }
  },
  "motion": {
    "fast": {
      "$value": "150ms",
      "$type": "duration"
    },
    "standard": {
      "$value": "240ms",
      "$type": "duration"
    }
  },
  "breakpoint": {
    "sm": {
      "$value": "640px",
      "$type": "dimension"
    },
    "md": {
      "$value": "768px",
      "$type": "dimension"
    },
    "lg": {
      "$value": "1024px",
      "$type": "dimension"
    }
  },
  "zIndex": {
    "header": {
      "$value": 10,
      "$type": "number"
    },
    "overlay": {
      "$value": 20,
      "$type": "number"
    }
  }
}
